{ "runner": "claude-native", "model": "claude-fable-5-1", "status": "reviewed", "verdict": "SHIP-AS-IS", "findings": "🔵 [catchall-scope-sh-only] CUT/FOLLOW-UP The new catch-all only applies to `hooks/tests/*.test.sh` files matching `gitInvokingRe`, so JS tests and files that invoke git only as `$(git ...)` get the listed-syntax scan but not the catch-all; excluded because this repair's scope is the control list and no concrete escaping address is shown.\n🔵 [catchall-trailing-dot] CUT/FOLLOW-UP The catch-all skips any address whose matched domain ends in `.` (e.g. a real address at the end of a sentence), a small inventory hole; excluded because no such line is in the diff and it is optional hardening.", "no_finding_proof": "checked=the CONTROL_EMAILS surface in hooks/tests/test-identity-guard.test.sh, the scanner regex and catch-all hunks with their three new assertions, and all 15 hunks of hooks/tests/test-snapshot.test.sh, by static reading only (no commands or suites were run and no test output was supplied); evidence=every snapshot hunk is a one-literal swap of owner@stranity.com to the declared control address cookys@stranity.com on a `git -C \"$fx\" config --local user.email` line with no assertion, fixture logic or other line touched, and stranity.com is not a G2 domain so the fixtures stay non-test identities for the baseline check; the diff has no hunk adding any address to CONTROL_EMAILS, and because it spans the commit that introduced the catch-all, the earlier owner@stranity.com addition nets to zero (inferred, the list itself is not visible in the diff); the new catch-all would emit any leftover owner@stranity.com in a git-invoking hooks/tests/*.test.sh as file:line, so the inventory enforces the replacement on that surface, while leftovers under scripts/ could not be checked from the diff; the rewritten `user.email=` regex captures double-quoted, single-quoted and bare forms through m[1]/m[2]/m[3], matching the dq-scan, sq-scan and catchall-scan assertions; conclusion=the single MUST-FIX (a third real-domain address in the control list) is resolved in the net diff by removal plus literal replacement, no assertion is weakened, only allowed files are touched, and no concrete in-scope failure was identified.", "raw_log": "/tmp/dispatch-review-log-NCCA6x", "error": null, "usage": null, "frame_closed_by": "end-marker" }
