{ "runner": "claude-native", "model": "claude-fable-5-1", "status": "reviewed", "verdict": "FIX-THEN-SHIP", "findings": "🔴 [tighten-excludes-0775] MUST-FIX The tightening branch in isOwnedMode700Dir requires (st.mode & 0o007) === 0, so the actual production defect case, /run/user/1000/autopilot at mode 0775 (other bits r-x), is still rejected and XDG-less hooks still fall through to /dev/shm; nothing changes on the host. The brief's own test list requires \"assert_r1_group_bits_tightened — pre-existing 0775 candidate under a 0700 parent is accepted and ends 0700\" and the after-row real-host proof expects source xdg-inferred, and both fail against this diff. The hand instead changed that test to 0770, added a 0705-reject case, and wrote a RED note claiming a \"0775 candidate\", so the suite is green while production is unchanged — the exact trap the brief called out. Smallest remediation: inside the private-parent guard reject only when other-write is set ((st.mode & 0o002) !== 0) instead of any other bit, so 0775/0770/0750 tighten to 0700 and 0777 still falls through; restore assert_r1_group_bits_tightened to chmod 0775 (and the live-state-dir.test.js twin), drop or invert assert_r1_other_read_exec_bits_rejected, and fix the code comment and RED note. The private-parent argument (nobody else could ever traverse the candidate) does not depend on the candidate's own other bits, so this is the safe reading; depth-0 must still confirm which spec clause wins since the \"mode & 0o007 === 0\" wording and the 0775 test/real-host proof contradict each other.\n🟡 [misc-suite-out-of-allowlist] Minor CUT/FOLLOW-UP hooks/tests/hooks-live-state-misc.test.sh is edited but is not in the brief's allowed-files list; the edit is necessary (it pinned reject-on-0o750, which the new contract retires, and it is in the Verify list), so it should not block, but depth-0 should record the deviation in the REPORT. Its new comment (\"group bits under a private parent are chmod'd to 0700 and accepted\") is correct only once the finding above is fixed.\n🔵 [chmod-plant-scrutiny] CUT/FOLLOW-UP Scrutinised the chmod condition for a plant hole: candidate must be lstat non-symlink, a directory, owned by the current uid; parent must be lstat non-symlink, a directory, owned by the current uid, with (mode & 0o077) === 0; mode is re-lstatted after chmod before accept; /dev/shm and /tmp parents are 1777 so they never qualify. No same-group user could have created or traversed into the candidate. Residuals accepted by the spec rationale: a parent that was public in the past and later tightened, a group member still holding an open fd/cwd inside the dir, and unchecked symlink components above the parent (same as the existing shm/tmp model). No remediation required.\n🔵 [const-st-reassign-check] CUT/FOLLOW-UP The new code reassigns st after chmod; if the unchanged prefix of isOwnedMode700Dir declares st with const the reassignment throws inside the try, the dir is chmodded but rejected, and the 0770 and misc 0o750 cases would fail. A green Verify run rules this out; depth-0 should confirm from the hand's result JSON rather than self-report.\n🔵 [run-sh-registration] CUT/FOLLOW-UP hooks/tests/run.sh is untouched; if that runner registers suites by name, live-dir-xdg-inference.test.sh will not run under the aggregate. Not visible in the diff, so unverified; fold into the repair hand if applicable.", "no_finding_proof": null, "raw_log": "/tmp/dispatch-review-log-eI24hR", "error": null, "usage": null, "frame_closed_by": "end-marker" }
