{ "runner": "claude-native", "model": "claude-fable-5-1", "status": "reviewed", "verdict": "SHIP-AS-IS", "findings": "🔵 [r5-spawn-error-swallowed] CUT/FOLLOW-UP `startWatcherDetached` attaches a no-op `child.on('error')` and returns `started` synchronously, so an async spawn failure (e.g. `nohup` or `sh` missing from PATH while `flock` is present) yields no stderr line from `set`; the realistic missing-tool case (`flock`) is caught by the foreground probe and tested (case 5), and `nohup`/`sh` are universally present, so this is hardening only. Smallest follow-up: write one stderr line in the `error` handler (it fires on nextTick, before exit) or drop `nohup` since `detached:true` + redirected stdio already makes it redundant.\n🔵 [r5-suite-orphan-window] CUT/FOLLOW-UP `session-mode-watcher.test.sh` registers kill PIDs only from the published envelope; if a launch succeeds but no envelope appears within 15 s (slow host), the watcher is not in `KILL_PIDS` and survives the trap (bounded by `--idle-exit`, confined to the /dev/shm fixture live dir). Follow-up: also enumerate `count_watchers`-style `/proc` matches for `$KEY` in `cleanup_smw` and kill those by PID. Not blocking: lock-held and idle-exit bound it and nothing can reach the real store.\n🔵 [r5-autostart-string-only] CUT/FOLLOW-UP The switch honours only the literal string `0`; `false`/empty are treated as enabled. Matches the spec's stated contract (`0` = never start) and lib.sh exports exactly `0`, so no in-scope failure; note for the P3 idle-supersede row if the knob grows values.", "no_finding_proof": "checked=`scripts/session-mode.js` set path (startProjectWatcher placement after marker write and pointer, before stdout JSON; stderr-only output; try/catch fail-open; markerRepoIdentity delegation), `src/status/runs-watch.js` (single `watchLaunchArgv` used by both `launchUnderLock` and `startWatcherDetached`; foreground `flock -n` probe with status 1→busy/holder, error→flock_unavailable; `flockAvailable` mkdtemp moved inside try with null-guarded cleanup; exports extended, none removed), `hooks/tests/lib.sh` single export line, autostart switch added to `hooks/orchestrator-edit-gate.test.js` (both env builders), `hooks/run-approval-gate.test.js`, `scripts/tests/session-mode-null-admission.test.sh` (plus HOME/AUTOPILOT_SESSION_MODE_DIR isolation), new suite structure (mode 100755, sources lib.sh, ends with `finalize_test`, `# RED at 95634d0c` header with 13/33 red lines, fake HOME/CLAUDE_CONFIG_DIR/XDG_RUNTIME_DIR/AUTOPILOT_LIVE_DIR on /dev/shm/SESSION_MODE_DIR/COSTS_FILE/DISPATCH_RUNS_DIR, kill-by-PID trap, `/proc` argv scan instead of `pgrep -f`), codex mirrors, and `references/mods.md` against the spec's required content list; evidence=mirror blobs are byte-identical to sources (index hashes ce595411 for session-mode.js, 6714019a for runs-watch.js, ed694ff4 for mods.md, 3d9d6b84 for null-admission suite); the suite covers every spec case (set→envelope+fd 9 readlink equals lock, second set→same writer.pid+holder pid on stderr+stdout still parses, kill-by-PID→`flock -n` free→new writer, AUTOSTART=0→no envelope/no process, flock absent→rc 0+marker+stderr naming flock, non-repo rc 2 unchanged, markerRepoIdentity==scopeFromCwd for main/linked/symlink/non-repo) plus both R4 folds (unwritable TMPDIR→rc 2 `flock_unavailable` with no stack trace; `state.lastRuns` maintained and final-publish bound 80 project-wide vs 20 scope-local); mods.md states the S1 `modules` key relative to hooks.json with `../mods/<name>/register.ts`, the S4 degradation table with Image terminal-only and unusable over ssh+tmux, the S2 pointer path/resolution order/`$.fs` semantics (cwd-relative, no confinement, no `~`, no `code`), S5a reload re-fires session.start with `/clear` unverified, lock form (ii) with `/proc/locks` naming the exited flock helper and fd verification, and links to the spike evidence dir; conclusion=no concrete in-scope failure remains: the launch has one definition, `set` is fail-open on every probed outcome, the autostart switch is exported from lib.sh and set in every non-lib.sh `set` caller the diff names, no existing assertion was weakened, and the remaining items are hardening with no reachable defect under the spec's contract.", "raw_log": "/tmp/dispatch-review-log-B1zm3z", "error": null, "usage": null, "frame_closed_by": "end-marker" }
