{
  "runner": "cc-shim",
  "model": "GLM-5.2",
  "status": "reviewed",
  "verdict": "SHIP-AS-IS",
  "findings": "🔵 [p4-gate-reds-preexisting] CUT/FOLLOW-UP two of the P4.5 gates exit 1 in `p4/gates.txt` (check-plan-graduation, doc-drift-gate); every failing reference sits in lines this branch did not write (`scripts/dispatch-contract.pre.js` in docs/BACKLOG.md pre-existing content, `check-unarchived-branches.mjs`, `check-inputs-landed.sh`, five dangling 2026-01→2026-08 plan-evidence dirs) and the depth-0 note records a `git show develop:<file>` confirmation for each — excluded from this version because remediation means editing unrelated backlog rows and old plan debt outside the frozen plan's scope; follow-up belongs to those rows' owners, not this diff.\n🔵 [p4-gates-note-capture-mismatch] CUT/FOLLOW-UP the gates.txt note attributes the check-plan-graduation rc=1 to a `backlog_row_has_plan` violation (\"Run stage-graph v11 regression…\", 2026-10-11-review-packet-mode) that the captured output above it does not show (the capture prints only `plan_reference_dangling (report-only)` lines) — evidence-hygiene only: the pre-existing-on-develop conclusion still holds from the captured dangling refs alone; re-capture the gate output or correct the note in a follow-up.",
  "no_finding_proof": "checked=C7/P4 acceptance surfaces — references/worktree-placement.md against the P4.1 element list; backlog sidecar disposition table against the P4.2 gap table; docs/BACKLOG.md row replacement (gap-5 and gap-8 rows); CHANGELOG `## Unreleased` entry and absence of a version bump; P4.3 wiring (scripts-inventory row, resolver header comment, reference doc, CLAUDE.md inventory gate); project README status/progress rows; all six gate results in p4/gates.txt; evidence=the reference doc contains every P4.1 element (one-root rule, who-creates table with the three rail prefixes `hetero-`/`foreman-`/`batch-integ-`, marker-follows-session per D5, two-key handoff table with the per-repo vs per-worktree rationale of D8, temp-dir fallback for bare/separate-git-dir per D1, the `resolve-repo-placement.js main` + `git -C <main_checkout> pull --ff-only` owner line for gap 8, and a Not-covered section); the sidecar table marks gaps 1–8 plus 6b with dispositions matching the plan's table (5 deferred → new \"Cross-repo dispatch…\" BACKLOG row, 8 partly fixed → new \"finish-flow does not tell the owner…\" row, 7 out of scope, both new rows carry Status/Trigger/Source/Pointer); gates rc=0 for check-claude-md-inventory (235/235 scripts named — this covers the CLAUDE.md wiring step for a script created in P2), check-tmp-residue-registry (416 files, parity holds), check-reference-sizes, check-backlog-entries (exit 0, 157 entries, new_count 0), check-supersession-anchors, and sync-all --check (failures: []); the only rc=1 gates fail on references entirely outside this diff's added lines, each recorded as confirmed present in `git show develop:<file>`; the CHANGELOG entry matches the shipped P1–P3 behavior and the diff touches no version or manifest file; the only code change is a two-line header comment; conclusion=P4 is documentation and wiring only, every spec-required artifact is present and internally consistent with decisions D1–D12 as shipped in P1–P3, and the two red gates are baseline failures with recorded develop provenance rather than in-scope failures of this diff, so no MUST-FIX remains.",
  "raw_log": "/tmp/dispatch-review-log-xZ20kX",
  "error": null,
  "usage": null,
  "frame_closed_by": "end-marker"
}
