{
  "runner": "cc-shim",
  "model": "MiniMax-M3",
  "status": "reviewed",
  "verdict": "SHIP-AS-IS",
  "findings": "🟠 [markerRepoIdentity-undefined] CUT/FOLLOW-UP <`followRepoRoot` in `session-mode.js` calls `markerRepoIdentity(marker.repo_root)` as a fallback when `marker.repo_identity` is absent, but the symbol is neither defined nor imported in the visible diff. The try/catch masks the ReferenceError, so the function silently no-ops if a marker without `repo_identity` is ever read. Plan text says markers always store identity (the fallback path is dead code), so this is a latent dead reference, not a live defect — exclude from the current ship.>\n🔵 [scripts-inventory-row-inventory-check] CUT/FOLLOW-UP <`docs/scripts-inventory.md` adds a row for `resolve-repo-placement.js`; `check-claude-md-inventory.js` is listed in P4.5 gates but the row appears only in `scripts-inventory.md`, not in `CLAUDE.md`'s \"Worktree & branch lifecycle\" group list beyond what the diff shows. The diff DOES add `resolve-repo-placement.js` to the CLAUDE.md group list, so the inventory check should pass — noted as verified rather than a defect.>",
  "no_finding_proof": "checked=D1–D13 decisions and C1–C7 success criteria against the diff hunks; tested `scripts/resolve-repo-placement.js` (subcommands main/worktree/handoff, exit codes 0/1/2, prefix regex validation, bare-repo and separate-git-dir fallback, manual per-repo key with basename slugging, clear per-worktree key via sha1(realpath toplevel)); tested D3 prune in `main-checkout-boundary.sh` (-o -path …/.claude/worktrees -prune so worktree entries are not measured); tested D7 `inMarkedNestedWorktree` (parts[0]=='' && parts[0]=='..' guards, marker file existence via accessSync, both directions covered by orchestrator-edit-gate.test.js cases); tested D10 repo-residue-sweep skip only when `marker_valid !== true` (the opposite reading would drop rail liveness); tested D11 exclude `/.claude/worktrees/` in all three rails with the case branch guarded by `*/.claude/worktrees/*`; tested D5 followRepoRoot identity check (same-repo updates, foreign repo leaves marker alone, base_ref derived from updated repo_root); tested D6 pair logic on local-behind/ahead/diverged/one-side-missing using merge-base + is-ancestor; tested C3 advisory tokenisation (shared-word silent, no-match emits one stderr line, main checkout silent, generic/digit-only silent, case-only silent, detached-HEAD silent, exit code 0 in every case via symbolic-ref); tested C4 handoff resolver used by both hooks with `clearHandoffKey` exporting the same sha1(realpath toplevel) so the existing pinned `/clear` hashes are preserved; tested walker changes in identifier-scan.js / probe-unknown.js / lib/worktree-activity.js (only the root-relative .claude/worktrees is skipped, subdirs walked as their own root, node_modules still skipped in probe-unknown); verified per-rail placement tests in dispatch-hetero.test.sh (case 4 fresh-sandbox first placement, dirty worktree under $SBX/.claude/worktrees/, sandbox porcelain clean), dispatch-foreman.test.sh (precondition no .claude, worktree under $SBX/.claude/worktrees/, porcelain clean after cap case), dispatch-batch.test.sh (integration worktree under $R6/.claude/worktrees/, exclude line present); verified `parseArgs` rejects flag-without-value and unknown routes; verified prefix regex `^[A-Za-z0-9._-]+$` blocks `a/b` and other injection attempts; verified registry allowlist reasons mention the temp-dir fallback so the gate's \"match extracted prefix\" rule still holds for the rare fallback path; evidence=full diff hunks covering CHANGELOG, CLAUDE.md grouped list, BACKLOG.md gap-5/gap-8 rows, backlog-file disposition table, plan + rubric + project README + ladder.jsonl, scripts-inventory row, new resolver with built-ins + project-key only, main_checkout_fingerprint prune, orchestrator-edit-gate nested-worktree branch, three rails' new mktemp template + exclude case, session-mode D5/D6/advisory, stage-advance sessionRepoRoot, hook imports of clearHandoffKey, two new walker tests, new resolver test (91 lines covering main/worktree/handoff + exit codes + bare-repo fallback), new stage-advance cases for D5/D6/C3, new orchestrator-edit-gate cases for D7, new repo-residue-auto case for D10; conclusion=every plan decision D1–D13 and every success criterion C1–C7 has a corresponding code change and a test (or a recorded grep for P2.4); the single CUT item is a dead-code fallback behind a try/catch that the plan text explicitly says is unreachable in normal use, so it does not block the ship.",
  "raw_log": "/tmp/dispatch-review-log-GvHIuI",
  "error": null,
  "usage": null,
  "frame_closed_by": "end-marker"
}
