{
  "runner": "cc-shim",
  "model": "GLM-5.2",
  "status": "reviewed",
  "verdict": "SHIP-AS-IS",
  "findings": "🔵 [p1-4-suite-run-evidence] CUT/FOLLOW-UP Plan P1.4 lists session-mode.test.sh, session-mode-phase/-watcher/-bind-campaign-root, plain-session-marker.test.js and mission-routing-admission.test.sh; this diff pins only stage-advance.test.sh green-at-head (red-green.json, dispositions cite 205/0 for that suite). Run and record the remaining P1.4 suites when executing the phase workflow; excluded from blocking because no concrete failure is shown and D6's base behaviour change is spec-acknowledged and pinned red-at-base by test (g).\n🔵 [sessionreporoot-identity-fallback] CUT/FOLLOW-UP stage-advance.js sessionRepoRoot requires a non-empty marker.repo_identity, while followRepoRoot additionally derives identity from an absolute marker.repo_root; a legacy marker with repo_root but no repo_identity never follows E1 into a linked worktree (keeps exactly today's behaviour). Optional symmetry hardening only; excluded because the conservative fallback preserves base semantics and all current markers store repo_identity.\n🔵 [default-branches-order-consumers] CUT/FOLLOW-UP DEFAULT_BRANCHES now flattens to develop,origin/develop,main,origin/main,master,origin/master (was develop,main,master,origin/develop,origin/main); only defaultBaseRef is observed consuming it in this diff, so confirm via the P1.4 suites that no other consumer pins the old flat order. Never blocks: the order change is D6's declared, test-pinned behaviour change.",
  "no_finding_proof": "checked=C1 linked-worktree E1 test and negative case, C2/D6 base_ref pair logic (DEFAULT_BRANCH_PAIRS, mergeBaseWithHead, isAncestor, defaultBaseRef) in scripts/session-mode.js, D5 followRepoRoot plus both cmdSetInit call sites and the `next.repo_root || repoRoot` fallback, D5 sessionRepoRoot and repoRoot precedence in scripts/stage-advance.js, the full P1.2 (a)–(h) test matrix in hooks/tests/stage-advance.test.sh, the plan-doc P1.2 sync, and internal consistency of the evidence artifacts (red-green.json, receipt-P1.json, chain, dispositions, findings, seats); evidence=hand-traced every D6 fixture to its asserted sha — (a) develop forced to C1 with origin/develop at C2 ⇒ isAncestor(C2,C1) false ⇒ remote C2; (b) local ahead ⇒ ancestor true ⇒ local C2; (c) diverged ⇒ false ⇒ remote CR; (g) first pair qualifies only via origin/develop ⇒ C2 where the old flat order returned main C1 (red at base); (h) lone local develop ⇒ C1 — so `isAncestor(remote,local)?localBase:remoteBase` plus the one-qualifies fallback implements the spec rule with the merge-base-with-HEAD filter kept and no fetch; followRepoRoot is identity-gated on both the --new-task and merge paths and the undefined/empty repo_root marker is now guarded by `next.repo_root || repoRoot` at both sites (verified finding 9c55 fixed), and the strengthened L/XL size asserts pin that the foreign-repo and follow-back writes actually happened; sessionRepoRoot compares scopeFromCwd identity to marker.repo_identity and never mutates the marker, so a foreign cwd falls through to marker.repo_root with repo_root byte-identical (negative case asserted); all git calls are execFileSync/spawnSync with argv arrays at existing trust levels (no new injection surface); red-green.json is VALIDATED with base_exit_code 1 / head_exit_code 0 and matching command digests, and the disposition refutes the exit-only Major with the recorded base-run output \"expected [0] got [4]\", proving the C1 suite red at base; conclusion=the P1 surfaces this diff claims (D5, D6, C1, C2, P1.2 a–h plus negative, plan-doc sync) are implemented per the frozen decisions and pinned red→green by a validated receipt, the single verified review finding is remediated inside this same diff, and the residual items above are CUT-grade follow-ups that never block, so no MUST-FIX remains.",
  "raw_log": "/tmp/dispatch-review-log-3KFMos",
  "error": null,
  "usage": null,
  "frame_closed_by": "end-marker"
}
