{
  "runner": "cc-shim",
  "model": "GLM-5.2",
  "status": "reviewed",
  "verdict": "FIX-THEN-SHIP",
  "findings": "🟠 [hetero-loop-p7-carveout] MUST-FIX — scripts/hetero-review-loop.js handleCollect special-cases `prevEntry.status === 'pending' && phase === 'p7'` to skip the previous-generation-finalized guard purely \"for test case 7\"; dev-flow phases are routinely named p1..pN, so any real phase named p7 can collect gen N over a non-finalized gen N-1, and handleFinalize only loads findings/dispositions for entries with `status === 'finalized' && dispositions_path`, so the skipped generation resolves to an empty findings map and closure-by-absence in scripts/lib/review-chain-derive.js silently closes every earlier verified finding — a verified Critical can be dropped and the receipt flip to SHIP-AS-IS (fail-open); smallest remediation: delete the carve-out and update hooks/tests/hetero-review-loop.test.sh case 7 to finalize gen 1 first (or assert the refusal).\n🟠 [phase-base-doc-path-mismatch] MUST-FIX — handleCollect persists the phase base at `<ledger>/review-<phase>/phase-<phase>.base` (path.join(reviewPhaseDir, `phase-${phase}.base`)), but skills/dev-flow/SKILL.md and skills/dev-flow/references/hetero-loops.md instruct `--phase-base \"$(cat <project>/ledger/phase-<p>.base)\"`; the documented `cat` target does not exist, --phase-base arrives empty, and the now-mandatory --phase-base check fails the gate on every documented invocation of the L-4 checklist; smallest remediation: point both docs at `<project>/ledger/review-<p>/phase-<p>.base` (or write the base file at the documented ledger-root path).\n🔵 [seat-count-cardinality-unchecked] FOLLOW-UP — check-phase-review-receipt.js Item 2 trusts chain-declared reviewed_seats/total_seats and never cross-checks `seat_artifact_sha256` cardinality or `seats` length against them (the new fixtures themselves pass with `seat_artifact_sha256: {}` and no seat fields); excluded from this version because the entire ledger sits inside the established forge boundary and the git-anchored checks (phase-base, branch head, diff/full-range sha) carry the gate — later add a `seat_artifact_sha256`-count == total_seats cross-check plus a failing `--min-reviewed-seats` fixture.\n🔵 [exclude-allowlist-duplicated] FOLLOW-UP — EXCLUDE_ALLOWLIST + isPathspecAllowed are duplicated verbatim in hetero-review-loop.js and check-phase-review-receipt.js rather than shared via scripts/lib/ beside review-chain-derive.js; future drift would let collect accept an exclusion the checker rejects (fail-closed but broken loops); excluded now because the two copies are byte-identical in this diff.\n🔵 [derive-purity-doc-vs-mutation] FOLLOW-UP — scripts/lib/review-chain-derive.js documents \"Purity: No side effects\" yet mutates passed-in chain entries' closed_findings (handleFinalize relies on this for persistence); harmless today because the checker's deepEqual(receipt.chain, chainOnDisk) runs before derive mutates the entries, but the contract should be documented or entries deep-cloned so the finalize-persisted and checker-compared chains cannot diverge later.\n🔵 [stale-capability-warning-assert-messages] CUT — hooks/tests/resolve-review-loop.test.sh capability-warning assertions now expect the three topology native-fallback warnings while the assert messages still read \"no operational capability warning\" (cases A–G, L4); the assertions themselves are correct per the D1 warning contract, only the human-readable messages are stale — rename next time the file is touched, not worth a blocking change.",
  "no_finding_proof": null,
  "raw_log": "/tmp/dispatch-review-log-d3NEP1",
  "error": null,
  "usage": null
}
